{
  "version": "5",
  "$schema": "schema.json",
  "model": {
    "version": "1.0",
    "defaultSchema": "default",
    "schemas": [
      {
        "type": "custom",
        "name": "default",
        "sqlDialectFactory": null,
        "jdbcUser": null,
        "jdbcPassword": null,
        "jdbcUrl": null,
        "jdbcCatalog": null,
        "jdbcSchema": null,
        "factory": "org.apache.calcite.adapter.file.FileSchemaFactory",
        "operand": {
          "directory": "/Users/kennethstott/ndc-calcite/adapters/file/data/files"
        }
      }
    ]
  },
  "model_file_path": "./model.json",
  "fixes": true
}