{
  "version": "5",
  "$schema": "schema.json",
  "model": {
    "version": "1.0",
    "defaultSchema": "SALES",
    "schemas": [
      {
        "type": "custom",
        "name": "SALES",
        "factory": "org.apache.calcite.adapter.csv.CsvSchemaFactory",
        "operand": {
          "directory": "/Users/kennethstott/ndc-calcite/adapters/csv/resources"
        }
      }
    ]
  },
  "model_file_path": "./model.json",
  "fixes": true
}